{"$schema":"https://json-schema.org/draft/2020-12/schema","additionalProperties":false,"properties":{"approved_connectors":{"items":{"$ref":"#/$defs/connectorAuthority"},"minItems":1,"type":"array"},"approved_mutations":{"items":{"const":"registry_promotion:instrument_identity","type":"string"},"type":"array","uniqueItems":true},"catalog_keys":{"items":{"minLength":1,"type":"string"},"minItems":1,"type":"array","uniqueItems":true},"disclosure_ceiling":{"$ref":"#/$defs/disclosure"},"grant_id":{"pattern":"^grant:[a-z0-9][a-z0-9._-]*(:[a-z0-9][a-z0-9._-]*)*$","type":"string"},"handles":{"items":{"additionalProperties":false,"properties":{"handle":{"$ref":"#/$defs/capabilityHandleId"},"provider":{"minLength":1,"type":"string"}},"required":["handle","provider"],"type":"object"},"minItems":1,"type":"array"},"inquiry_hash":{"$ref":"#/$defs/blake3Hash"},"issued_at":{"pattern":"^[0-9]{4}-[0-9]{2}-[0-9]{2}T[0-9]{2}:[0-9]{2}:[0-9]{2}Z$","type":"string"},"issuer":{"const":"operator","type":"string"},"max_budget":{"$ref":"#/$defs/budget"},"model_context":{"$ref":"#/$defs/modelContext"},"output":{"$ref":"#/$defs/output"},"schema":{"const":"grant.v0","type":"string"}},"required":["approved_connectors","approved_mutations","catalog_keys","disclosure_ceiling","grant_id","handles","inquiry_hash","issued_at","issuer","max_budget","model_context","output","schema"],"type":"object","$defs":{"blake3Hash":{"pattern":"^blake3:[0-9a-f]{64}$","type":"string"},"budget":{"additionalProperties":false,"properties":{"bytes":{"minimum":0,"type":"integer"},"cost_units":{"minimum":0,"type":"integer"},"human_reviews":{"minimum":0,"type":"integer"},"model_tokens":{"minimum":0,"type":"integer"},"source_calls":{"minimum":0,"type":"integer"}},"required":["bytes","cost_units","human_reviews","model_tokens","source_calls"],"type":"object"},"capabilityHandleId":{"allOf":[{"pattern":"^handle:[a-z0-9][a-z0-9._-]*(:[a-z0-9][a-z0-9._-]*)+$","type":"string"},{"not":{"pattern":"(://|=|access[-_]key|api[-_]key|credential|password|private[-_]key|secret|token|connection[-_]string)"}}]},"connectorAuthority":{"additionalProperties":false,"properties":{"operations":{"items":{"minLength":1,"type":"string"},"minItems":1,"type":"array","uniqueItems":true},"provider":{"minLength":1,"type":"string"}},"required":["operations","provider"],"type":"object"},"disclosure":{"const":"public","type":"string"},"modelContext":{"const":"metadata_only","type":"string"},"output":{"additionalProperties":false,"properties":{"disclosure":{"$ref":"#/$defs/disclosure"},"kind":{"const":"time_series_safe_instrument_key","type":"string"}},"required":["disclosure","kind"],"type":"object"}}}
