{"approved_connectors":[{"operations":["describe_table","fetch_result","run_query"],"provider":"cmdrvl-data-mcp"},{"operations":["read"],"provider":"openfigi"}],"approved_mutations":["registry_promotion:instrument_identity"],"catalog_keys":["gleif_entities","gleif_isin_lei","openfigi","snowflake://edgar_db.dbt_wrangling_edgar/nport_holdings_authoritative","snowflake://edgar_db.dbt_wrangling_edgar/wrgl_edgar_nport_confirmation__coupon"],"disclosure_ceiling":"public","grant_id":"grant:nport_identity_closure:v0","handles":[{"handle":"handle:cmdrvl-data-mcp:read","provider":"cmdrvl-data-mcp"},{"handle":"handle:openfigi:read","provider":"openfigi"}],"inquiry_hash":"blake3:190e2c15269fe6ef1c3cf979e653d5395ea7ff70cd183e5ed3d3fca7fd7624eb","issued_at":"2026-09-15T00:00:00Z","issuer":"operator","max_budget":{"bytes":20000000000,"cost_units":10000,"human_reviews":500,"model_tokens":0,"source_calls":100000},"model_context":"metadata_only","output":{"disclosure":"public","kind":"time_series_safe_instrument_key"},"schema":"grant.v0"}
